{
    "receiptId":  "LDB-LIVE-PHONE-QUALIFICATION-20260923",
    "timestamp":  "2026-09-23T21:52:40.1018560Z",
    "deviceId":  "LDB-b1219fbe-25e8-4a8a-9e6b-6bdaeb83775a",
    "capability":  "device.bridge.live-runtime",
    "authorizationBasis":  "Creator authorization plus Android USB debugging owner approval",
    "preGate":  "GitHub Pages live; source tests PASS; clean Android build PASS; APK under 100 MiB target",
    "result":  "PASS",
    "postGate":  "Phone-local bridge externally reachable through authorized ADB forwarding; unauthenticated protected route rejected 401; owner STOP changed protected route to 403",
    "evidenceHashes":  [
                           "db4a3f893e2ba584f8d33afac22e507929a58914acee7f07d52e55a7cb097c8d",
                           "502247c34e274fc9e4ee7bc8b4215f09d3b6d25f3e3e1eb1a649df85f37720d7"
                       ]
}
